{"$schema":"https://json-schema.org/draft/2020-12/schema","$id":"https://reviewgraphen.dev/schemas/reviewgraphen.generic_review_diagnostics.v1.schema.json","type":"object","additionalProperties":false,"required":["schema","observer_api","request_id","run_id","terminal_code","stages"],"properties":{"schema":{"const":"reviewgraphen.generic_review_diagnostics.v1"},"observer_api":{"const":"reviewgraphen.runtime.generic_stage_observer@1"},"request_id":{"oneOf":[{"type":"null"},{"$ref":"#/$defs/id"}]},"run_id":{"oneOf":[{"type":"null"},{"$ref":"#/$defs/id"}]},"terminal_code":{"type":"string","minLength":1,"maxLength":128},"stages":{"type":"array","minItems":6,"maxItems":6,"prefixItems":[{"$ref":"#/$defs/ingest"},{"$ref":"#/$defs/synthesize"},{"$ref":"#/$defs/context"},{"$ref":"#/$defs/observer"},{"$ref":"#/$defs/report"},{"$ref":"#/$defs/artifact_write"}],"items":false}},"$defs":{"id":{"type":"string","pattern":"^[a-z][a-z0-9-]*:(?:sha256:[0-9a-f]{64}|[A-Za-z0-9._@:-]+)$"},"status":{"enum":["completed","failed","skipped"]},"elapsed":{"type":"integer","minimum":0},"ingest":{"type":"object","additionalProperties":false,"required":["stage","status","elapsed_microseconds"],"properties":{"stage":{"const":"ingest"},"status":{"$ref":"#/$defs/status"},"elapsed_microseconds":{"$ref":"#/$defs/elapsed"}}},"synthesize":{"type":"object","additionalProperties":false,"required":["stage","status","elapsed_microseconds"],"properties":{"stage":{"const":"synthesize"},"status":{"$ref":"#/$defs/status"},"elapsed_microseconds":{"$ref":"#/$defs/elapsed"}}},"context":{"type":"object","additionalProperties":false,"required":["stage","status","elapsed_microseconds"],"properties":{"stage":{"const":"context"},"status":{"$ref":"#/$defs/status"},"elapsed_microseconds":{"$ref":"#/$defs/elapsed"}}},"observer":{"type":"object","additionalProperties":false,"required":["stage","status","elapsed_microseconds"],"properties":{"stage":{"const":"observer"},"status":{"$ref":"#/$defs/status"},"elapsed_microseconds":{"$ref":"#/$defs/elapsed"}}},"report":{"type":"object","additionalProperties":false,"required":["stage","status","elapsed_microseconds"],"properties":{"stage":{"const":"report"},"status":{"$ref":"#/$defs/status"},"elapsed_microseconds":{"$ref":"#/$defs/elapsed"}}},"artifact_write":{"type":"object","additionalProperties":false,"required":["stage","status","elapsed_microseconds"],"properties":{"stage":{"const":"artifact_write"},"status":{"$ref":"#/$defs/status"},"elapsed_microseconds":{"$ref":"#/$defs/elapsed"}}}}}
