{"observer_api":"reviewgraphen.runtime.generic_stage_observer@1","request_id":"request:sha256:29f2a20edf52b9d6406024c0b07d5690f33ffb9a922d7790de3d6f91bd6ff0bc","run_id":"run:sha256:648d0286029a8f2b6ef1c58a073460727c5aa2dcf25d5dc312032f0f09ddf51e","schema":"reviewgraphen.generic_review_diagnostics.v1","stages":[{"elapsed_microseconds":155214387,"stage":"ingest","status":"completed"},{"elapsed_microseconds":18417362,"stage":"synthesize","status":"completed"},{"elapsed_microseconds":32801745,"stage":"context","status":"completed"},{"elapsed_microseconds":184,"stage":"observer","status":"completed"},{"elapsed_microseconds":1286043,"stage":"report","status":"completed"},{"elapsed_microseconds":316927,"stage":"artifact_write","status":"completed"}],"terminal_code":"0"}
